Song_ID,Title,Dancability,Artist,Genre_ID,Key_ID,User_ID,Lyrics,Creation_Date,Released_Status,Time_Signature
33,Hips Don't Lie (feat. Wyclef Jean),0.778,"Shakira,Wyclef Jean",1,17,none,"Ladies up in here tonight
No fighting
We got the refugees up in here (no fighting)
No fighting
Shakira, Shakira
I never really knew that she could dance like this (hey)
She make a man wants to speak Spanish
¿Cómo se llama? (Sí), bonita (sí)
Mi casa, su casa (Shakira, Shakira)
Oh, baby, when you talk like that
You make a woman go mad
So be wise (sí) and keep on (sí)
Reading the signs of my body (uno, dos, tres, cuatro)
I'm on tonight
You know my hips don't lie (no fighting)
And I'm starting to feel it's right
All the attraction, the tension
Don't you see, baby, this is perfection?
Hey, girl, I can see your body moving
And it's driving me crazy
And I didn't have the slightest idea
Until I saw you dancing (yeah)
And when you walk up on the dance floor
Nobody cannot ignore the way you move your body, girl (just move)
And everything so unexpected, the way you right and left it
So you can keep on shaking it (let's go)
I never really knew that she could dance like this
She make a man wants to speak Spanish
¿Cómo se llama? (Sí), bonita (sí)
Mi casa, su casa (Shakira, Shakira)
Oh, baby, when you talk like that
You make a woman go mad
So be wise (sí) and keep on (sí)
Reading the signs of my body (no fighting)
I'm on tonight
You know my hips don't lie (no fighting)
And I am starting to feel you, boy
Come on, let's go, real slow
Don't you see, baby, así es perfecto?
They know I am on tonight, my hips don't lie
And I'm starting to feel it's right
All the attraction, the tension
Don't you see, baby, this is perfection? (Shakira, Shakira)
Oh, boy, I can see your body moving
Half animal, half man
I don't, don't really know what I'm doing
But you seem to have a plan
My will and self-restraint
Have come to fail now, fail now
See, I am doing what I can, but I can't so you know
That's a bit too hard to explain (uno, dos, tres, cuatro)
Baila en la calle de noche (yeah)
Baila en la calle de día (let's go)
Baila en la calle de noche
Baila en la calle de día
I never really knew that she could dance like this
She make a man wants to speak Spanish
¿Cómo se llama? (Sí), bonita (sí)
Mi casa, su casa (Shakira, Shakira)
Oh, baby, when you talk like that
You know you got me hypnotized
So be wise (sí) and keep on (sí)
Reading the signs of my body
Señorita, feel the conga
Let me see you move like you come from Colombia
Yeah (ladies sí) (yeah yeah)
(Hey, yeah)
¡Mira en Barranquilla se baila así, say it! (yeah)
En Barranquilla se baila así (yeah)
Hey, brra!
Yeah, she's so sexy, every man's fantasy
A refugee like me back with the Fugees from a third world country
I go back like when 'Pac carried crates for Humpty Humpty
We leave the whole club dizzy
Why the CIA wanna watch us?
Colombians and Haitians
I ain't guilty, it's a musical transaction
Bo bop so bop, no more do we snatch ropes
Refugees run the seas 'cause we own our own boats (no fighting)
I'm on tonight, my hips don't lie
And I'm starting to feel you, boy
Come on, let's go, real slow
Baby, like this is perfecto (no fighting)
Oh, you know I'm on tonight, my hips don't lie
And I am starting to feel it's right
The attraction, the tension
Baby, like this is perfection
No fighting
No fighting
",2005-11-28,1,4
34,Stereo Hearts (feat. Adam Levine),0.646,"Gym Class Heroes,Adam Levine",1,8,none,"My heart's a stereo
It beats for you, so listen close
Hear my thoughts in every no-ote
Make me your radio
And turn me up when you feel low (turn it up a little bit)
This melody was meant for you (right there)
Just sing along to my stereo (Gym Class Hero, baby)
If I was just another dusty record on the shelf
Would you blow me off and play me like everybody else?
If I asked you to scratch my back, could you manage that?
Like it yikky yeah, check it Travie, I can handle that
Furthermore, I apologize for any skipping tracks
It's just the last girl that played me left a couple cracks
I used to, used to, used to, used to, now I'm over that
'Cause holding grudges over love is ancient artifacts
If I could only find a note to make you understand
I'd sing it softly in your ear and grab you by the hand
Just keep it stuck inside your head, like your favorite tune
And know my hearts a stereo that only plays for you
My heart's a stereo
It beats for you, so listen close
Hear my thoughts in every no-ote
Make me your radio
And turn me up when you feel low
This melody was meant for you
Just sing along to my stereo
to my stereo
(Oh, oh-oh, oh) just sing along to my stereo
Let's go!
If I was an old-school, fifty-pound boombox (remember them?)
Would you hold me on your shoulder, wherever you walk?
Would you turn my volume up in front of the cops?
And crank it higher every time they told you to stop
And all I ask is that you don't get mad at me
When you have to purchase mad D batteries
Appreciate every mixtape your friends make
You never know, we come and go like on the interstate (never know)
I think I finally found a note to make you understand
If you can hit it, sing along and take me by the hand
Just keep me stuck inside your head, like your favorite tune
You know my heart's a stereo that only plays for you
My heart's a stereo
It beats for you, so listen close (listen)
Hear my thoughts in every no-ote
Make me your radio (come on)
And turn me up when you feel low (turn it up)
This melody was meant for you
Just sing along to my stereo (sing along like)
to my stereo
(Oh, oh-oh, oh) just sing along to my stereo
I only pray you'll never leave me behind (never leave me)
Because good music can be so hard to find (so hard to find)
I take your hand, hold it closer to mine (yeah)
Thought love was dead, but now you're changing my mind
My heart's a stereo
It beats for you, so listen close
Hear my thoughts in every no-ote
Make me your radio
And turn me up when you feel low
This melody was meant for you
Just sing along to my stereo
",2011-11-15,1,4
35,Californication,0.592,Red Hot Chili Peppers,2,8,none,"Psychic spies from China try to steal your mind's elation
And little girls from Sweden dream of silver screen quotation
And if you want these kind of dreams it's Californication
It's the edge of the world and all of Western civilization
The sun may rise in the East, at least it settled in a final location
It's understood that Hollywood sells Californication
Pay your surgeon very well to break the spell of aging
Celebrity skin, is this your chin, or is that war you're waging?
First born unicorn
Hardcore soft porn
Dream of Californication
Dream of Californication
Dream of Californication
Dream of Californication
Marry me, girl, be my fairy to the world, be my very own constellation
A teenage bride with a baby inside getting high on information
And buy me a star on the boulevard, it's Californication
Space may be the final frontier, but it's made in a Hollywood basement
And Cobain, can you hear the spheres singing songs off Station To Station?
And Alderaan's not far away, it's Californication
Born and raised by those who praise control of population
Well, everybody's been there and I don't mean on vacation
First born unicorn
Hardcore soft porn
Dream of Californication
Dream of Californication
Dream of Californication
Dream of Californication
Destruction leads to a very rough road, but it also breeds creation
And earthquakes are to a girl's guitar, they're just another good vibration
And tidal waves couldn't save the world from Californication
Pay your surgeon very well to break the spell of aging
Sicker than the rest, there is no test, but this is what you're craving
First born unicorn
Hardcore soft porn
Dream of Californication
Dream of Californication
Dream of Californication
Dream of Californication",1999-06-08,1,4
36,Bring Me To Life,0.312,Evanescence,5,16,none,"How can you see into my eyes like open doors?
Leading you down into my core
Where I've become so numb
Without a soul
My spirit's sleeping somewhere cold
Until you find it there and lead it back home

(Wake me up) wake me up inside (I can't wake up)
Wake me up inside (save me)
Call my name and save me from the dark (wake me up)
Bid my blood to run (I can't wake up)
Before I come undone (save me)
Save me from the nothing I've become

Now that I know what I'm without
You can't just leave me
Breathe into me and make me real
Bring (bring) me (me) to life

(Wake me up) wake me up inside (I can't wake up)
Wake me up inside (save me)
Call my name and save me from the dark (wake me up)
Bid my blood to run (I can't wake up)
Before I come undone (save me)
Save me from the nothing I've become

Bring me to life
I've been living a lie
There's nothing inside
Bring me to life

Frozen (frozen) inside without your touch
Without your love, darling
Only (only) you are the life among the dead

All of this time, I can't believe I couldn't see
Kept in the dark, but you were there in front of me
I've been sleeping a thousand years, it seems
Got to open my eyes to everything
Without a thought, without a voice, without a soul
Don't let me die here
(There must be something more) bring me to life

(Wake me up) wake me up inside (I can't wake up)
Wake me up inside (save me)
Call my name and save me from the dark (wake me up)
Bid my blood to run (I can't wake up)
Before I come undone (save me)
Save me from the nothing I've become

Bring me to life
I've been living a lie
There's nothing inside
Bring me to life",2003-01-01,1,4
37,Hot N Cold,0.706,Katy Perry,1,10,none,"You change your mind
Like a girl changes clothes
Yeah you, PMS
Like a bitch
I would know
And you over think
Always speak
Cryptically
I should know
That you're no good for me
'Cause you're hot then you're cold
You're yes then you're no
You're in then you're out
You're up then you're down
You're wrong when it's right
It's black and it's white
We fight, we break up
We kiss, we make up
(You) You don't really want to stay, no
(You) But you don't really want to go
You're hot then you're cold
You're yes then you're no
You're in then you're out
You're up then you're down
We used to be
Just like twins
So in sync
The same energy
Now's a dead battery
Used to laugh 'bout nothing
Now you're plain boring
I should know
That you're not gonna change
'Cause you're hot then you're cold
You're yes then you're no
You're in then you're out
You're up then you're down
You're wrong when it's right
It's black and it's white
We fight, we break up
We kiss, we make up
(You) You don't really want to stay, no
(You) But you don't really want to go
You're hot then you're cold
You're yes then you're no
You're in then you're out
You're up then you're down
Someone call the doctor
Got a case of a love bipolar
Stuck on a roller coaster
Can't get off this ride
You change your mind
Like a girl changes clothes
'Cause you're hot then you're cold
You're yes then you're no
You're in then you're out
You're up then you're down
You're wrong when it's right
It's black and it's white
We fight, we break up
We kiss, we make up
You're hot then you're cold
You're yes then you're no
You're in then you're out
You're up then you're down
You're wrong when it's right
It's black and it's white
We fight, we break up
We kiss, we make up
(You) You don't really want to stay, no
(You) But you don't really want to go
You're hot then you're cold
You're yes then you're no
You're in then you're out
You're up then you're down",2008-06-17,1,4
38,Rock with You - Single Version,0.808,Michael Jackson,3,4,none,"Girl, close your eyes
Let that rhythm get into you
Don't try to fight it
There ain't nothing that you can do
Relax your mind
Lay back and groove with mine
You gotta feel that heat
And we can ride the boogie
Share that beat of love
I wanna rock with you (all night)
Dance you into day (sunlight)
I wanna rock with you (all night)
We're gonna rock the night away (rock, right)
Out on the floor
There ain't nobody there but us
Girl, when you dance
There's a magic that must be love
Just take it slow
'Cause we got so far to go
When you feel that heat
And we're gonna ride the boogie
Share that beat of love
I wanna rock with you (all night)
Dance you into day (sunlight)
I wanna rock with you (all night)
We gon' rock the night away (rock, right)
And when the groove is dead and gone (yeah)
You know that love survives
So we can rock forever, on
I wanna rock with you
I wanna groove with you
Wanna rock (all night)
With you, girl (sunlight)
Rock with you, rock with you, yeah (all night)
Dance the night away (rock, right)
I wanna rock with you, yeah (all night)
Rock you into day (sunlight)
I wanna rock with you (all night)
Rock the night away (rock, right)
Feel the heat, feel the beat (all night)
(Woo)
Rock you into day (sunlight)
I wanna rock (all night)
Rock the night away (rock, right)",1979-08-10,1,4
39,Smells Like Teen Spirit,0.502,Nirvana,5,14,none,"Load up on guns, bring your friends
It's fun to lose and to pretend
She's over bored and self-assured
Oh, no, I know a dirty word
Hello, hello, hello, how low?
Hello, hello, hello, how low?
Hello, hello, hello, how low?
Hello, hello, hello
With the lights out, it's less dangerous
Here we are now, entertain us
I feel stupid and contagious
Here we are now, entertain us
A mulatto, an albino
A mosquito, my libido, yeah
Hey
Yeah
I'm worse at what I do best
And for this gift I feel blessed
Our little group it's always been
And always will until the end
Hello, hello, hello, how low?
Hello, hello, hello, how low?
Hello, hello, hello, how low?
Hello, hello, hello
With the lights out, it's less dangerous
Here we are now entertain us
I feel stupid and contagious
Here we are now entertain us
A mulatto, an albino
A mosquito, my libido, yeah
Hey
Yeah
And I forget, just why I taste
Oh yeah, I guess it makes me smile
I found it hard, it's hard to find
Oh well, whatever, never mind
Hello, hello, hello, how low?
Hello, hello, hello, how low?
Hello, hello, hello, how low?
Hello, hello, hello
With the lights out, it's less dangerous
Here we are now, entertain us
I feel stupid, and contagious
Here we are now, entertain us
A mulatto, an albino
A mosquito, my libido
A denial, a denial
A denial, a denial
A denial, a denial
A denial, a denial
A denial",1991-09-26,1,4
40,I Was Made For Lovin' You,0.768,KISS,2,14,none,"Mmmm, yeah

Do, do, do, do, do, do, do, do, do
Do, do, do, do, do, do, do
Do, do, do, do, do, do, do, do, do
Do, do, do, do, do, do, do

Tonight
I wanna give it all to you
In the darkness
There's so much I want to do

And tonight
I wanna lay it at your feet
'Cause, girl, I was made for you
And, girl, you were made for me

I was made for loving you, baby
You were made for loving me
And I can't get enough of you, baby
Can you get enough of me?

Tonight
I wanna see it in your eyes
Feel the magic
There's something that drives me wild

And tonight
We're going to make it all come true
'Cause, girl, you were made for me
And, girl, I was made for you

I was made for loving you, baby
You were made for loving me
And I can't get enough of you, baby
Can you get enough of me?

I was made for loving you, baby
You were made for loving me
And I can give it all to you, baby
Can you give it all to me?

Oh, oh, oh
Can't get enough
Oh, oh
I can't get enough
Oh, oh, oh
I can't get enough
Yeah

Do, do, do, do, do, do, do, do, do
Do, do, do, do, do, do, do

I was made for loving you, baby
You were made for loving me
And I can't get enough of you, baby
Can you get enough of me?

Oh, I was made
You were made
I can't get enough
No, I can't get enough

I was made for loving you, baby
You were made for loving me",1979-03-23,1,4
41,Back In Black,0.31,AC/DC,2,14,none,"Back in black
I hit the sack
I've been too long, I'm glad to be back
Yes, I'm let loose
From the noose
That's kept me hanging about
I've been looking at the sky
'Cause it's gettin' me high
Forget the hearse 'cause I never die
I got nine lives
Cat's eyes
Abusin' every one of them and running wild
'Cause I'm back
Yes, I'm back
Well, I'm back
Yes, I'm back
Well, I'm back, back
Well, I'm back in black
Yes, I'm back in black
Back in the back
Of a Cadillac
Number one with a bullet, I'm a power pack
Yes, I'm in a bang
With a gang
They've got to catch me if they want me to hang
'Cause I'm back on the track
And I'm beatin' the flack
Nobody's gonna get me on another rap
So look at me now
I'm just makin' my play
Don't try to push your luck, just get out of my way
'Cause I'm back
Yes, I'm back
Well, I'm back
Yes, I'm back
Well, I'm back, back
Well, I'm back in black
Yes, I'm back in black
Well, I'm back, yes, I'm back
Well, I'm back, yes, I'm back
Well, I'm back, back
Well, I'm back in black
Yes, I'm back in black
Oh, yeah
Oh, yeah
Take my love
Oh, yeah, yeah
Oh, yeah, yeah, ooh, yeah
Well, I'm back (I'm back)
Back (I'm back)
Back (I'm back)
Back (I'm back)
Back (I'm back)
Back
Back in black
Yes, I'm back in black
I've hit the sack",1980-07-25,1,4
42,FE!N (feat. Playboi Carti),0.569,"Travis Scott,Playboi Carti",6,14,none,"Just come outside for the night (yeah)
Take your time, get your light (yeah)
Johnny Dang, huh-uh
I been out geekin'
Bitch
Fein', fein', fein', fein'-fein' (yeah)
Fein', fein', fein', fein'-fein' (yeah)
Fein', fein', fein', fein'-fein'
Fein', fein', fein', fein' (yeah)
The career's more at stake when you in your prime (at stake)
Fuck that paper, baby, my face on the dotted line (dot, yeah)
I been flyin' out of town for some peace of mind (yeah, yeah, bitch)
It's like always they just want a piece of mine (ah)
I been focused on the future, never on right now (ah)
But I'm sippin' that kombucha, either pink or brown (it's lit)
I'm the one that introduced you to the you right now (mm, let's go)
Oh my God, that bitch bite (that bitch bite)
But alright (alright), tryna vibe (tryna vibe this)
In the night, come alive
Ain't asleep, ain't a-, ain't a-, ain't-ain't-ain't-
Fein', fein', fein', fein'-fein'
Fein', fein', fein', fein'-fein'
Fein', fein', fein', fein'-fein'
Fein', fein', fein', fein', fein'
Fein', fein', fein'
Syrup, whoa, what?
What?
(Homixide, Homixide, Homixide, Homixide) what?
(Yeah, whoa, yeah, yeah)
(Homixide, Homixide, Homixide, Homixide, yeah)
(Yeah, hol' up, yeah)
Yeah, I just been poppin' my shit it's been gettin' live, hol' up (shit)
Yeah, you try to come wrong 'bout this shit, we poppin' ya tires, hol' up (shit)
Uh, hunnid round, whoa, feelin' like I'm on ten
Playin' both sides with these hoes (hol' up)
Shawty, I'm fuckin' yo' friends (hol' up)
I been goin' crazy, shawty, I've been in the deep end
She not innocent, uh, shit, she tryna go
Fein', fein' (talm 'bout), fein', fein'-fein'-fein' (yeah, syrup, oh-oh, what?)
Fein', fein', fein', fein'-fein'-fein' (syrup, oh-oh)
Fein', fein', fein', fein'-fein'-fein' (talm 'bout, talm 'bout, let's go)
I just been icin' my hoes
I just been drippin' my ho (drippin' my ho)
This is a whole 'nother level, shawty
I got these hoes on they toes (hoes on they toes)
I put the bitch on the road
She tryna fuck on the O, hol' up, hol' up
I got this ho with me, she tryna show me some', hol' up, hol' up
I got flows for days, these niggas ain't knowin' none, hol' up, hol' up
Me and my bro locked in, you know we on one, hol' up (slatt, slatt)
We in the spot goin' crazy, until the sun up
You worried about that ho, that ho done chose us (slatt, bitch-ass)
Uh, pistols all in the kitchen, can't give the zip code up, hol' up, yeah (wow)
Fein', fein', fein' (hol' up, hol' up, huh, yeah)
Why the fuck these niggas actin' like they know us?
Double O, Cactus, yeah, we towed up, uh (skrrt, skrrt)
Switch out the bag, these niggas get rolled up, hol' up, slatt (it's lit)
Everything hit, hol' up
Everything Homixide, Homixide (Homixide, Homixide, Homixide, Homixide)
Fein', fein', fein', fein'-fein'-fein'
(Homixide, Homixide, Homixide, Homixide, Homixide, Homixide, Homixide)",2023-07-28,1,4
43,On BS,0.842,"Drake,21 Savage",4,19,none,"Yeah, whoa, whoa, whoa
I had to cut some niggas off, they didn't mean me no good
I come from the ghetto, so my trunk is in my hood
She wouldn't wear no panties 'round me even if she could
Gave out plenty spankings 'til they got it understood
Fuck the nosebleeds, baby, come sit on this wood
If you know it's tension, don't come 'round me like it's good
I got street smarts and you can't get this out no book
I can't right my wrongs, but I can still write these hooks
Oh, time to get exposed
You ain't been from 'round here, nigga, come get off your show
Savage said you pussy and he hit it on the nose
But that border's open, why you actin' like it's closed?
I don't know
Y'all be goin' in and out recessions
The same way that I be goin' in and out of Texas
Or in and out my sessions, or in and out her best friends
Or in and out these courtrooms, my lawyer like, ""Objection""
Yeah, whoa, whoa
All my bitches Spanish, Boricua
Water on my neck, these diamonds came with coral reefer
She from overseas, I had to buy her a new visa
Met your wife in Vegas, but I hit her in Ibiza
She a supermodel, so she only eatin' Caesar
Used to date a rapper, but he acted like a diva
Niggas hustlin' backwards, out here ballin' with the re-up
Popped an Adderall, I feel like I can lift a tree up
Seen too many cameras, so I never lift my ski up (yeah)
I jump on your song and make you sound like you the feature
I jump on your song and make a label think they need ya, for real (yeah)
On that bullshit (okay), on that bullshit (okay)
On that bullshit (okay), on that bullshit (okay)
On that bullshit (okay), on that bullshit (okay)
On that bullshit, we on all the bullshit (okay)
On that bullshit (okay), on that bullshit (okay, okay)
On that bullshit (okay), on that bullshit (yeah)
On that bullshit (okay), on that bullshit (okay)
All the bullshit
Damn, maybe I should do a twenty, maybe I should break that twenty, do a ten
Maybe I should break that ten, do a five, then if it gets live, do a five again
If he held his tongue on that live, he'd be alive again, damn
My uncle's sister know she raised a real one, ill one
It's been thirty minutes, I don't feel nothin'
Oh shit, wait a minute, think I'm startin' to feel somethin'
Where you get this motherfuckin' pill from?
Heard they got some sanctions on my name
Heard they plottin' on my name, heard they bankin' on my name
I got Lita in this bitch and he might spank it on a lane
I'm just- what? In the cut, throwin' Franklins on her frame
I'm a- ayy, I'm a gentleman, I'm generous
I blow a half a million on you hoes, I'm a feminist
I never put no prices on the beef until we end this shit
I pay a half a million for his soul, he my nemesis
On that bullshit (okay), on that bullshit (okay)
On that bullshit (okay), on that bullshit (okay)
On that bullshit (okay), on that bullshit (okay)
On that bullshit, we on all the bullshit (okay)
On that bullshit (okay), on that bullshit (okay, okay)
On that bullshit (okay), on that bullshit (yeah)
On that bullshit (okay), on that bullshit (okay)
All the bullshit
Nah, I'm on, it's midnight, I don't care
Nothing's happening on a Wednesday, I don't care, I'm on
I'm looking for the smoke
These guys sitting front row, man, poof, who needs that?
Let me put my window down, I need fresh air
We don't want that, we want bars
The reason why we listen to 21 and The Boy
That's what we do in Paris, we don't do Fashion Week
Fashion Week, it's for the last decade, it's not for us
It's about the lights, the lights that we put on in the city
The lights of the Eiffel Tower
I'm in charge of it, I'm the one who's putting it on every day
And you try to flex next, next to me on the red light with your ugly
Whatever, flexing, most expensive car, V12
I drive a four-cylinder, I come from nothing but I'm doing something
And you cannot catch my drive
As fast as you try to go, you will never catch me, man
There is only one way, and this way I'm driving, nobody can do it
I'm Birdman, that's who I am
In Paris
Brrt, brrt",2022-11-04,1,4
